{
  "locale": "en-US",
  "client_id": "4dd69e99-07e7-c040-a514-ccde0cfd4881",
  "version": "72.0a1",
  "release_channel": "nightly",
  "addon_version": "20191119043902",
  "user_prefs": 255,
  "session_id": "{3e3fce7a-d015-7d44-9404-3547a600a9ec}",
  "page": "about:newtab",
  "event": "CLICK",
  "source": "TOP_SITES",
  "action_position": 0,
  "value": "{\"icon_type\": \"rich_icon\"}",
  "profile_creation_date": 16587,
  "region": "CA",
  "shield_id": "activity-stream-shield-study-bug-1238122",
  "browser_session_id": "e7e52665-7db3-f348-9918-e93160eb2ef3"
}
